category,context,question,response
RAG,Return delivery ko lagi city vitra free hunxa. City bahira ko lagi Rs. 100 return charge hunxa.,return delivery ko lagi charge lagcha?,City vitra return free hunxa ra bahira Rs. 100 charge hunxa.
RAG,Hamro system ma order track garna milxa. Tracking link email ra SMS ma provide garincha.,order track garna milxa?,"Ho, order track garna milxa. Tracking link provide garincha."
RAG,Delivery process order confirm bhaisake pachi turunta suru garincha. 24 hours vitra dispatch hunxa.,delivery process kati bela suru hunxa?,Delivery process confirm pachi turunta suru hunxa.
RAG,Hamro delivery system ma specific time select garne option abhile chaina. Delivery 10 baje dekhi 6 baje samma garincha.,delivery ko lagi specific time select garna milxa?,"Specific time select garna milcha chaina, delivery 10 baje dekhi 6 baje samma hunxa."
RAG,Hamro delivery packaging tamper-proof hunxa. Product ko safety ko lagi bubble wrap ra strong box use garincha.,delivery packaging secure hunxa?,"Ho, delivery packaging secure hunxa ra tamper-proof hunxa."
RAG,Hamro ma delivery postpaid (COD) option available xa. Payment delivery ko time ma garna milxa.,delivery postpaid xa?,"Ho, delivery postpaid xa. Payment COD ko time ma garna milxa."
RAG,Order cancel gare delivery charge refund hudaina. Cancelation charge alag laagxa.,order cancel gare delivery charge refund hunxa?,Order cancel gare delivery charge refund hudaina.
RAG,Hamro delivery timing morning 10 baje dekhi evening 6 baje samma ho. Special request ma timing adjust garincha.,delivery ko timing kati ho?,Delivery timing morning 10 baje dekhi evening 6 baje samma ho.
RAG,Hamro ma Kathmandu valley bahira delivery ko lagi Rs. 150 charge laagxa. Delivery 3-5 din vitra garincha.,outside valley delivery charge kati hunxa?,Outside valley delivery ko lagi Rs. 150 charge laagxa.
RAG,Hamro COD service all over Nepal available xa. Delivery timing 2-5 din vitra hunxa.,COD delivery everywhere hunxa?,"Ho, COD delivery all over Nepal available xa."
RAG,Hamro same day delivery service city vitra matra available xa. Extra Rs. 250 charge laagxa.,delivery same day ma possible hunxa?,Same day delivery city vitra matra possible hunxa. Extra Rs. 250 charge laagxa.
RAG,Hamro minimum order Rs. 500 hunuparcha free delivery ko lagi. City bahira delivery ma charge laagxa.,minimum order free delivery ko lagi kati hunuparcha?,Free delivery ko lagi minimum order Rs. 500 hunuparcha.
RAG,Hamro delivery service weekend ma pani available xa. Timing morning 10 baje dekhi evening 6 baje samma ho.,delivery weekend ma garincha?,"Ho, delivery weekend ma garincha."
RAG,Hamro system ma delivery order track garna milxa. Tracking link confirmation email ma provide garincha.,delivery order track garna milxa?,"Ho, delivery order track garna milxa."
RAG,Hamro customer support delivery related queries ko lagi contact garna 24/7 available xa. Toll-free number website ma xa.,delivery ko lagi contact kasari garne?,Delivery ko lagi contact garna toll-free number use garna milxa.
RAG,Hamro holiday delivery service active hunxa. Delivery timing holiday ma 10 baje dekhi 3 baje samma ho.,holiday delivery available hunxa?,"Ho, holiday delivery available hunxa."
RAG,Hamro free delivery Kathmandu valley vitra available xa. Valley bahira delivery ma charge laagxa.,free delivery kati bela hunxa?,Free delivery Kathmandu valley vitra matra hunxa.
RAG,Hamro delivery service secure hunxa. Tamper-proof packaging ra insured shipping use garincha.,delivery secure hunxa?,"Ho, delivery secure hunxa."
RAG,Urgent delivery ko lagi special helpline available xa. Customer support 24/7 active hunxa.,urgent delivery ko lagi contact garna milxa?,"Ho, urgent delivery ko lagi contact garna milxa."
RAG,Hamro delivery options ma standard delivery ra express delivery available xa. Express delivery ma additional charge hunxa.,delivery options k k hunxa?,Delivery options ma standard delivery ra express delivery available hunxa.
RAG,Hamro delivery service ma same address ma delivery garna milxa. Address confirm garepachi dispatch hunxa.,delivery same address ma garna milxa?,"Ho, delivery same address ma garna milxa."
RAG,Return delivery process 7 din vitra request garna parcha. Pickup free xa city vitra.,return delivery process kasari hunxa?,Return delivery process 7 din vitra suru hunxa.
RAG,Hamro delivery 100% guarantee xa. Timely delivery ko lagi customer support active hunxa.,delivery guarantee hunxa?,"Ho, delivery 100% guarantee hunxa."
RAG,Hamro ma order cancel gare Rs. 50 charge lagcha. Refund delivery charge vitra include hudaina.,order cancel gare charge lagxa?,Order cancel gare Rs. 50 charge laagxa.
RAG,Hamro express delivery ko lagi Rs. 300 extra charge laagxa. Delivery 1 din vitra hunxa.,express delivery charge kati hunxa?,Express delivery ko lagi Rs. 300 charge hunxa.
RAG,Hamro bulk order delivery ko lagi alag scheduling hunxa. Delivery charge discount pani garincha.,bulk order ko delivery possible hunxa?,"Ho, bulk order delivery possible hunxa."
RAG,Hamro delivery suru garna online order confirm garnu parcha. Payment method select garepachi delivery process suru hunxa.,delivery suru garna k garna parcha?,Delivery suru garna order confirm garna parcha.
RAG,Hamro delivery service all over Nepal available xa. City vitra free delivery xa ra city bahira Rs. 150 laagxa.,delivery service available xa?,"Ho, delivery service available xa. City vitra free xa, city bahira Rs. 150 laagxa."
RAG,Hamro Kathmandu valley vitra delivery free hunxa. Outside valley Rs. 200 charge laagxa.,delivery charge kati hunxa?,"Kathmandu valley vitra free xa, outside valley Rs. 200 charge hunxa."
RAG,Hamro delivery service all over Nepal hunxa. Delivery charge Rs. 120 hunxa ra 2-3 din vitra garincha.,delivery all over Nepal hunxa?,"Ho, all over Nepal delivery hunxa. Rs. 120 charge hunxa."
RAG,Hamro ma inside Pokhara delivery free hunxa. Outside Pokhara delivery ko lagi Rs. 100 charge hunxa.,delivery ko lagi charge kati lagxa?,"Inside Pokhara free xa, outside Rs. 100 charge hunxa."
RAG,Hamro service Nepal bhar delivery garna milxa. Rs. 150 charge lageko hunxa sabai location ma.,Nepal bhar delivery available hunxa?,"Ho, Nepal bhar delivery available xa. Rs. 150 charge hunxa."
RAG,Hamro delivery Kathmandu valley vitra free hunxa. Valley bahira minimum Rs. 120 charge laagxa.,delivery ko lagi minimum charge kati ho?,"Valley vitra free xa, bahira minimum Rs. 120 charge hunxa."
RAG,Hamro Kathmandu ko bahira delivery ko lagi Rs. 150 charge laagxa. Delivery 3-5 din vitra hunxa.,delivery charge Kathmandu ko bahira kati hunxa?,Kathmandu bahira Rs. 150 charge hunxa.
RAG,Hamro Kathmandu city vitra free delivery hunxa. Outside Kathmandu ko lagi Rs. 180 charge laagxa.,free delivery available xa?,"Kathmandu city vitra free delivery xa, outside Rs. 180 charge hunxa."
RAG,"Delivery charge fixed xa. City vitra Rs. 50 hunxa, city bahira Rs. 150.",delivery charge fixed xa?,"Ho, delivery charge fixed xa. City vitra Rs. 50 ra city bahira Rs. 150 hunxa."
RAG,Hamro service ma delivery sabai thau ma hunxa. Delivery cost Rs. 200 laagxa.,delivery hunxa ki hudaina?,"Ho, delivery sabai thau ma hunxa. Rs. 200 charge hunxa."
RAG,Inside valley free delivery hunxa. Outside valley ko lagi Rs. 250 laagxa.,inside valley free delivery hunxa?,"Ho, inside valley free delivery hunxa."
RAG,"Hamro delivery service Kathmandu ma matra hoina, all over Nepal hunxa. Kathmandu vitra free xa, bahira Rs. 150 charge laagxa.",delivery Kathmandu ma matra ho?,"Hoina, Kathmandu matra hoina, all over Nepal delivery hunxa."
RAG,Delivery cost city vitra Rs. 70 xa. City bahira Rs. 200 laagxa.,delivery cost kati ho?,City vitra Rs. 70 ra city bahira Rs. 200 delivery cost hunxa.
RAG,"Ho, Kathmandu vitra matra free delivery hunxa. Outside Kathmandu Rs. 150 charge laagxa.",free delivery only Kathmandu ma ho?,"Ho, free delivery Kathmandu ma matra ho."
RAG,Hamro delivery ghar ghar ma hunxa. Charge city vitra Rs. 50 ra city bahira Rs. 150 hunxa.,delivery ghar ghar ma hunxa?,"Ho, delivery ghar ghar ma hunxa. City vitra Rs. 50, city bahira Rs. 150 charge hunxa."
RAG,Hamro delivery service Nepal bhitra matra ho. Nepal bahira delivery currently available chaina.,delivery outside Nepal hunxa?,"Hoina, delivery Nepal bhitra matra available xa."
RAG,Delivery charge inside valley Rs. 100 hunxa. Valley bahira ko lagi Rs. 200 laagxa.,delivery charges kasto xa?,Inside valley Rs. 100 xa ra outside valley Rs. 200 hunxa.
RAG,Delivery charge city vitra free hunxa. City bahira ko lagi Rs. 150 laagxa.,kasto delivery charge hunxa?,"City vitra free hunxa, city bahira Rs. 150 hunxa."
RAG,Minimum delivery charge Rs. 50 ho. Long distance delivery ko lagi Rs. 200 laagxa.,delivery minimum charge kati ho?,Minimum charge Rs. 50 ho ra long distance delivery ko lagi Rs. 200 laagxa.
RAG,"Ho, valley bhitra delivery free hunxa. Valley bahira ko lagi Rs. 100 charge laagxa.",valley bhitra delivery free xa?,"Ho, valley bhitra delivery free xa."
RAG,Hamro delivery service available xa. Dharan vitra free delivery hunxa ra Dharan bahira Rs. 120 charge laagxa. Delivery 2-3 din vitra garincha.,delivery available xa?,"Ho, delivery service available xa. Dharan vitra free delivery hunxa ra bahira Rs. 120 laagxa."
RAG,Hamro delivery Dharan vitra free hunxa. Dharan bahira Rs. 120 charge laagxa. Delivery 2-3 din vitra hunxa.,delivery charge kati hunxa?,"Dharan vitra free xa, Dharan bahira Rs. 120 charge hunxa."
RAG,"Ho, Dharan bhitra free delivery hunxa. Bahira ko lagi Rs. 120 charge laagxa ra delivery 2-3 din vitra hunxa.",Dharan bhitra free delivery hunxa?,"Ho, Dharan bhitra free delivery hunxa."
RAG,"Hamro delivery timing Dharan bhitra 1 din vitra ho. Dharan bahira 2-3 din lagcha, Rs. 120 charge laagxa.",delivery ko timing kati ho?,"Dharan vitra delivery 1 din vitra hunxa, bahira 2-3 din lagcha ra Rs. 120 charge hunxa."
RAG,Dharan vitra free delivery xa. Dharan bahira Rs. 120 charge hunxa ra delivery 2-3 din vitra hunxa.,free delivery available xa?,"Ho, Dharan vitra free delivery xa."
RAG,Delivery Dharan vitra free xa. Bahira ko lagi Rs. 120 charge hunxa ra delivery 2-3 din vitra hunxa.,delivery cost kati lagcha?,"Dharan vitra free xa, Dharan bahira Rs. 120 charge hunxa."
RAG,Delivery Dharan vitra free hunxa. Dharan bahira Rs. 120 laagxa ra delivery 2-3 din vitra garincha.,delivery Nepal bhar hunxa?,"Ho, delivery Nepal bhar hunxa. Dharan vitra free hunxa ra bahira Rs. 120 charge laagxa."
RAG,"Ho, outside Dharan delivery available xa. Delivery charge Rs. 120 hunxa ra 2-3 din vitra garincha.",outside Dharan delivery hunxa?,"Ho, outside Dharan delivery hunxa. Rs. 120 charge hunxa."
RAG,Delivery Dharan vitra free hunxa. Dharan bahira Rs. 120 laagxa ra delivery 2-3 din vitra hunxa.,delivery charge kati ho?,"Dharan vitra free hunxa, Dharan bahira Rs. 120 charge hunxa."
RAG,"Hamro delivery ghar ghar ma hunxa. Dharan vitra free xa, Dharan bahira Rs. 120 charge laagxa ra delivery 2-3 din vitra garincha.",delivery ghar ma hunxa?,"Ho, delivery ghar ghar ma hunxa. Dharan vitra free xa ra bahira Rs. 120 charge hunxa."
RAG,"Ho, Dharan bahira delivery garincha. Rs. 120 charge laagxa ra delivery 2-3 din vitra hunxa.",Dharan bahira delivery garincha?,"Ho, Dharan bahira delivery garincha. Rs. 120 charge hunxa."
RAG,Hamro delivery Dharan vitra same day hunxa. Dharan bahira ko lagi 2-3 din lagcha ra Rs. 120 charge laagxa.,delivery ko lagi kati din lagxa?,"Dharan vitra same day hunxa, Dharan bahira 2-3 din lagcha ra Rs. 120 charge hunxa."
RAG,Hamro delivery service Dharan vitra free hunxa. Dharan bahira Rs. 120 laagxa ra delivery 2-3 din vitra hunxa.,delivery options kasto xa?,Delivery options ma Dharan vitra free delivery xa ra bahira Rs. 120 charge hunxa.
RAG,Hamro delivery Nepal bhar available xa. Dharan vitra free xa ra bahira Rs. 120 laagxa. Delivery 2-3 din vitra hunxa.,delivery kaha samma possible xa?,Delivery Nepal bhar possible xa. Dharan vitra free hunxa ra bahira Rs. 120 charge hunxa.
RAG,"Ho, Dharan vitra free delivery hunxa. Bahira Rs. 120 laagxa ra delivery 2-3 din vitra garincha.",free delivery Dharan vitra ho?,"Ho, Dharan vitra free delivery hunxa."
RAG,Dharan ko bahira delivery ko lagi Rs. 120 charge hunxa. Delivery 2-3 din vitra garincha.,Dharan ko bahira ko lagi delivery charge kati ho?,Dharan bahira Rs. 120 charge hunxa.
RAG,Hamro delivery service Dharan vitra same day hunxa. Dharan bahira 2-3 din lagcha ra Rs. 120 charge laagxa.,delivery service fast hunxa?,"Ho, delivery service fast xa. Dharan vitra same day ra bahira 2-3 din lagcha."
RAG,Hamro delivery Nepal bhar available xa. Dharan vitra free delivery xa ra Dharan bahira Rs. 120 laagxa. Delivery 2-3 din vitra hunxa.,delivery Nepal bhar hunxa ki hoina?,"Ho, delivery Nepal bhar hunxa. Dharan vitra free xa ra bahira Rs. 120 charge hunxa."
RAG,Dharan vitra delivery cost free hunxa. Bahira Rs. 120 charge laagxa ra 2-3 din vitra garincha.,delivery cost free xa?,"Dharan vitra free xa, bahira Rs. 120 charge hunxa."
RAG,Hamro delivery charge Dharan vitra free xa. Dharan bahira Rs. 120 laagxa ra delivery 2-3 din vitra hunxa.,delivery charge kasto hunxa?,"Dharan vitra free hunxa, bahira Rs. 120 charge hunxa."
RAG,Hamro delivery service Dharan vitra free hunxa. Dharan bahira delivery charge Rs. 120 laagxa ra delivery 2-3 din vitra garincha.,Dharan bhitra delivery free hunxa?,"Ho, Dharan bhitra free delivery hunxa."
RAG,Dharan vitra free delivery hunxa. Dharan bahira ko lagi Rs. 120 charge laagxa ra delivery 2-3 din vitra garincha.,delivery charge kati lagcha?,"Dharan vitra free hunxa, Dharan bahira Rs. 120 charge hunxa."
RAG,Hamro delivery Dharan vitra same day hunxa. Dharan bahira 2-3 din lagcha ra Rs. 120 charge hunxa.,delivery kati din lagxa?,"Dharan vitra same day delivery hunxa, Dharan bahira 2-3 din lagcha."
RAG,Hamro delivery charge Dharan vitra free ho. Bahira Rs. 120 charge laagxa ra 2-3 din vitra delivery garincha.,delivery ko charge kati ho?,"Dharan vitra free xa, bahira Rs. 120 charge hunxa."
RAG,Dharan vitra free delivery hunxa. Outside Dharan delivery ko lagi Rs. 120 charge laagxa ra delivery 2-3 din vitra garincha.,outside Dharan delivery charge kati ho?,Outside Dharan delivery ko lagi Rs. 120 charge hunxa.
RAG,Hamro delivery service Dharan vitra free hunxa. Outside Dharan Rs. 120 charge hunxa ra delivery 2-3 din vitra garincha.,Dharan vitra delivery free ho?,"Ho, Dharan vitra free delivery hunxa."
RAG,Hamro delivery Dharan vitra 1 din vitra garincha. Outside Dharan delivery ko lagi 2-3 din lagcha ra Rs. 120 charge hunxa.,delivery ko lagi kati din lagxa?,"Dharan vitra 1 din vitra garincha, bahira 2-3 din lagcha ra Rs. 120 charge hunxa."
RAG,Hamro delivery service Dharan vitra free hunxa. Dharan bahira Rs. 120 charge laagxa ra delivery 2-3 din vitra garincha.,free delivery Dharan ko lagi ho?,"Ho, Dharan vitra free delivery hunxa."
RAG,Hamro delivery charge Dharan vitra free ho. Dharan bahira Rs. 120 laagxa ra delivery 2-3 din vitra garincha.,delivery ko charge kati ho?,"Dharan vitra free hunxa, Dharan bahira Rs. 120 charge hunxa."
RAG,Hamro delivery service Dharan vitra free hunxa ra 2-3 din vitra garincha. Outside Dharan delivery charge Rs. 120 laagxa.,delivery kasto ho?,"Dharan vitra free delivery ho, outside Dharan Rs. 120 charge hunxa."
RAG,"Ho, Dharan bahira delivery garincha. Rs. 120 charge hunxa ra delivery 2-3 din vitra garincha.",Dharan bahira delivery garincha?,"Ho, Dharan bahira delivery garincha. Rs. 120 charge hunxa."
RAG,Dharan vitra delivery free hunxa. Outside Dharan Rs. 120 charge laagxa ra delivery 2-3 din vitra garincha.,Dharan vitra delivery charge kati ho?,"Dharan vitra free hunxa, outside Dharan Rs. 120 charge hunxa."
RAG,Hamro delivery charge Dharan vitra free hunxa. Outside Dharan Rs. 120 charge laagxa ra delivery 2-3 din vitra garincha.,delivery charge free hunxa?,"Dharan vitra free hunxa, outside Dharan Rs. 120 charge hunxa."
RAG,Hamro delivery Kathmandu vitra free hunxa. Outside Kathmandu delivery Rs. 120 charge hunxa ra delivery 2-3 din vitra garincha.,delivery Kathmandu ma matra ho?,"Hamro delivery Kathmandu vitra free ho, outside Kathmandu Rs. 120 charge hunxa."
RAG,"Ho, Dharan vitra free delivery garincha. Outside Dharan Rs. 120 charge laagxa ra delivery 2-3 din vitra garincha.",Dharan vitra free delivery garincha?,"Ho, Dharan vitra free delivery garincha."
RAG,"Ho, outside Dharan delivery garincha. Rs. 120 charge laagxa ra delivery 2-3 din vitra garincha.",outside Dharan delivery garincha?,"Ho, outside Dharan delivery garincha. Rs. 120 charge hunxa."
RAG,Hamro delivery Dharan vitra free hunxa. Dharan bahira Rs. 120 charge hunxa ra delivery 2-3 din vitra garincha.,Dharan ma delivery charge kati ho?,"Dharan vitra free hunxa, Dharan bahira Rs. 120 charge hunxa."
RAG,Hamro delivery Kathmandu ma matra available ho. Dharan vitra free delivery hunxa ra Dharan bahira Rs. 120 charge laagxa.,delivery Kathmandu ma matra ho?,"Ho, delivery Kathmandu ma matra ho."
RAG,Hamro delivery Dharan vitra free hunxa. Dharan bahira delivery Rs. 120 charge hunxa ra 2-3 din vitra garincha.,Dharan ko vitra delivery free xa?,"Ho, Dharan ko vitra delivery free xa."
RAG,Dharan bahira delivery charge Rs. 120 hunxa ra delivery 2-3 din vitra hunxa.,Dharan ko bahira ko lagi delivery charge kati ho?,Dharan ko bahira ko lagi delivery charge Rs. 120 hunxa.
RAG,Hamro delivery Dharan vitra free hunxa. Dharan bahira delivery charge Rs. 120 hunxa ra delivery 2-3 din vitra garincha.,delivery charge kati lagxa Dharan bahira?,Dharan bahira delivery charge Rs. 120 hunxa.
RAG,Dharan vitra delivery free ho. Dharan bahira delivery Rs. 120 charge hunxa ra delivery 2-3 din vitra garincha.,delivery cost free ho?,"Dharan vitra free delivery hunxa, Dharan bahira Rs. 120 charge hunxa."
RAG,Hamro delivery service Dharan vitra same day hunxa. Dharan bahira delivery ko lagi 2-3 din lagcha ra Rs. 120 charge hunxa.,delivery 2 din ma garincha?,"Dharan vitra same day delivery hunxa, Dharan bahira 2-3 din lagcha ra Rs. 120 charge hunxa."
RAG,"Hamro delivery Dharan vitra same day garincha. Dharan bahira delivery 2-3 din vitra garincha, Rs. 120 charge hunxa.",delivery kitne din ma hunxa?,"Dharan vitra same day hunxa, Dharan bahira 2-3 din vitra garincha."
RAG,Hamro delivery Dharan vitra free hunxa. Outside Dharan delivery charge Rs. 120 hunxa ra 2-3 din vitra garincha.,delivery kasto cha?,"Dharan vitra free delivery cha, bahira Rs. 120 charge hunxa."
RAG,"Ho, Dharan ko bahira delivery garincha. Rs. 120 charge hunxa ra delivery 2-3 din vitra garincha.",Dharan ko bahira delivery garincha?,"Ho, Dharan ko bahira delivery garincha. Rs. 120 charge hunxa."
RAG,Hamro delivery service Dharan vitra free hunxa. Dharan bahira delivery charge Rs. 120 hunxa ra 2-3 din vitra garincha.,Dharan bahira delivery charge kati ho?,Dharan bahira delivery charge Rs. 120 hunxa.
RAG,Hamro delivery service Dharan vitra same day hunxa. Dharan bahira delivery ko lagi 2-3 din lagcha ra Rs. 120 charge hunxa.,delivery ko timing kati ho?,"Dharan vitra same day delivery hunxa, bahira 2-3 din lagcha ra Rs. 120 charge hunxa."
RAG,"Dharan vitra delivery fast hunxa, same day garincha. Dharan bahira 2-3 din lagcha ra Rs. 120 charge hunxa.",delivery kasto fast xa?,"Dharan vitra fast delivery garincha, bahira 2-3 din lagcha ra Rs. 120 charge hunxa."
RAG,Hamro delivery Dharan vitra free hunxa. Dharan bahira delivery charge Rs. 120 hunxa ra delivery 2-3 din vitra garincha.,delivery ko charge kati ho?,"Dharan vitra free hunxa, bahira Rs. 120 charge hunxa."
RAG,"Ho, Dharan vitra free delivery hunxa. Dharan bahira Rs. 120 charge hunxa ra delivery 2-3 din vitra garincha.",Dharan vitra free delivery hunxa?,"Ho, Dharan vitra free delivery hunxa."
RAG,"Ho, Dharan ko bahira delivery garincha. Rs. 120 charge hunxa ra delivery 2-3 din vitra garincha.",Dharan ko bahira delivery garincha?,"Ho, Dharan ko bahira delivery garincha. Rs. 120 charge hunxa."
RAG,Hamro delivery service Dharan vitra same day garincha. Dharan bahira delivery ko lagi 2-3 din lagcha ra Rs. 120 charge hunxa.,Dharan ko vitra delivery kati din ma garincha?,"Dharan vitra same day delivery garincha, Dharan bahira 2-3 din lagcha ra Rs. 120 charge hunxa."
RAG,Dharan vitra free delivery cha. Bahira Rs. 120 charge hunxa ra delivery 2-3 din vitra garincha.,delivery charge free cha?,"Dharan vitra free delivery cha, bahira Rs. 120 charge hunxa."
RAG,Hamro delivery Dharan vitra free hunxa. Dharan bahira Rs. 120 charge hunxa ra delivery 2-3 din vitra garincha.,delivery ko charge kati ho Dharan ma?,"Dharan vitra free hunxa, Dharan bahira Rs. 120 charge hunxa."
RAG,Hamro delivery service Dharan vitra free hunxa. Outside Dharan Rs. 120 charge laagxa ra 2-3 din vitra delivery garincha.,Dharan ma matra delivery ho?,"Ho, Dharan ma matra delivery hunxa. Outside Dharan Rs. 120 charge hunxa."
RAG,Hamro delivery Dharan vitra free hunxa. Outside Dharan Rs. 120 charge hunxa ra delivery 2-3 din vitra garincha.,Dharan ko vitra delivery charge free ho?,"Ho, Dharan ko vitra delivery charge free ho."
RAG,Dharan vitra free delivery hunxa. Dharan bahira delivery charge Rs. 120 hunxa ra 2-3 din vitra garincha.,delivery ko charge kati ho Dharan bahira?,Dharan bahira delivery ko charge Rs. 120 hunxa.
RAG,Hamro delivery service Dharan vitra free hunxa. Dharan bahira Rs. 120 charge hunxa ra 2-3 din vitra delivery garincha.,delivery charge kasto ho?,"Dharan vitra free delivery hunxa, bahira Rs. 120 charge hunxa."
RAG,Hamro delivery Dharan vitra free hunxa. Outside Dharan Rs. 120 charge hunxa ra delivery 2-3 din vitra garincha.,Dharan bahira delivery kasto ho?,Dharan bahira delivery Rs. 120 charge hunxa ra 2-3 din vitra garincha.
RAG,Hamro delivery Dharan vitra free hunxa. Dharan bahira Rs. 120 charge hunxa ra delivery 2-3 din vitra garincha.,outside Dharan delivery charge kati ho?,Dharan bahira delivery charge Rs. 120 hunxa.
RAG,Hamro delivery Dharan vitra free hunxa. Dharan bahira Rs. 120 charge hunxa ra delivery 2-3 din vitra garincha.,Dharan ko vitra delivery free cha?,"Ho, Dharan ko vitra delivery free cha."
RAG,Hamro delivery Dharan vitra same day garincha. Dharan bahira delivery 2-3 din vitra garincha ra Rs. 120 charge hunxa.,delivery ko time kati ho?,"Dharan vitra same day delivery garincha, Dharan bahira 2-3 din vitra garincha."
RAG,Hamro delivery service Dharan vitra free hunxa. Outside Dharan Rs. 120 charge hunxa ra delivery 2-3 din vitra garincha.,Dharan ma matra delivery garincha?,"Ho, Dharan ma matra delivery garincha."
RAG,Hamro delivery service Dharan vitra same day garincha. Outside Dharan delivery ko lagi 2-3 din lagcha ra Rs. 120 charge hunxa.,delivery 2 din ma garincha?,"Dharan vitra same day delivery garincha, bahira 2-3 din lagcha ra Rs. 120 charge hunxa."
RAG,"Ho, Dharan vitra free delivery garincha. Outside Dharan Rs. 120 charge hunxa ra delivery 2-3 din vitra garincha.",Dharan vitra free delivery garincha?,"Ho, Dharan vitra free delivery garincha."
RAG,Hamro delivery Dharan vitra free hunxa. Dharan bahira Rs. 120 charge hunxa ra delivery 2-3 din vitra garincha.,delivery charge kati ho?,"Dharan vitra free hunxa, bahira Rs. 120 charge hunxa."
RAG,Hamro delivery Dharan vitra free hunxa. Outside Dharan delivery Rs. 120 charge hunxa ra 2-3 din vitra garincha.,Dharan bahira delivery charge kati ho?,Outside Dharan delivery charge Rs. 120 hunxa.
RAG,"Ho, Dharan vitra delivery same day garincha. Dharan bahira delivery 2-3 din vitra garincha ra Rs. 120 charge hunxa.",Dharan vitra delivery same day garincha?,"Ho, Dharan vitra delivery same day garincha."
RAG,Hamro delivery Dharan vitra free hunxa. Dharan bahira Rs. 120 charge hunxa ra delivery 2-3 din vitra garincha.,Dharan ma delivery free cha?,"Ho, Dharan ma delivery free cha."
RAG,Hamro delivery Dharan vitra same day garincha. Dharan bahira delivery ko lagi 2-3 din lagcha ra Rs. 120 charge hunxa.,delivery kati din ma garincha?,"Dharan vitra same day garincha, bahira 2-3 din lagcha ra Rs. 120 charge hunxa."
RAG,"Ho, Dharan vitra free delivery garincha. Outside Dharan delivery charge Rs. 120 hunxa ra delivery 2-3 din vitra garincha.",Dharan vitra free delivery garincha?,"Ho, Dharan vitra free delivery garincha."
RAG,Hamro delivery service Dharan vitra free hunxa. Outside Dharan Rs. 120 charge hunxa ra delivery 2-3 din vitra garincha.,Dharan bahira ko lagi delivery charge kati ho?,Outside Dharan delivery charge Rs. 120 hunxa.
RAG,Hamro delivery Dharan vitra free hunxa. Dharan bahira delivery 2-3 din vitra garincha ra Rs. 120 charge hunxa.,Hamro delivery service kati din ma garincha?,"Dharan vitra same day delivery hunxa, bahira 2-3 din lagcha."
RAG,Hamro delivery service Dharan vitra free hunxa. Outside Dharan Rs. 120 charge hunxa ra delivery 2-3 din vitra garincha.,delivery kasto garincha?,"Dharan vitra free delivery garincha, bahira Rs. 120 charge hunxa ra 2-3 din lagcha."
RAG,Hamro delivery Dharan vitra same day garincha. Dharan bahira delivery 2-3 din vitra garincha ra Rs. 120 charge hunxa.,delivery ko time kati ho?,"Dharan vitra same day delivery hunxa, bahira 2-3 din lagcha."
RAG,Hamro delivery service Dharan vitra free hunxa. Dharan bahira Rs. 120 charge hunxa ra delivery 2-3 din vitra garincha.,kaha samma delivery garincha?,"Hamro delivery service all over Nepal ma garincha. Dharan vitra free ho, bahira Rs. 120 charge hunxa."
RAG,Hamro delivery service Dharan vitra same day garincha. Dharan bahira delivery ko lagi 2-3 din lagcha ra Rs. 120 charge hunxa.,delivery kati din lagxa?,"Dharan vitra same day delivery hunxa, bahira 2-3 din vitra garincha."
RAG,Hamro delivery Dharan vitra same day garincha. Dharan bahira delivery 2-3 din lagcha ra Rs. 120 charge hunxa.,kati din lagne ho delivery garna?,"Dharan vitra same day hunxa, bahira 2-3 din lagcha ra Rs. 120 charge hunxa."
RAG,"Hamro delivery service all over Nepal ma garincha. Dharan vitra free hunxa, bahira Rs. 120 charge hunxa ra 2-3 din vitra garincha.",kaha bata delivery garincha?,"Hamro delivery service all over Nepal ma garincha. Dharan vitra free, bahira Rs. 120 charge hunxa."
